{
  "schema_version": "1.0.0",
  "id": "xCell_v1",
  "method": "xcell",
  "version": "xCell-1.1.0-20e2919",
  "organism": "Homo sapiens",
  "identifier_namespace": "gene_symbol",
  "package": {
    "name": "xCell",
    "version": "1.1.0",
    "commit": "20e2919eefd37e15af35f29f4944e30697098a28",
    "source_url": "https://github.com/dviraran/xCell/archive/20e2919eefd37e15af35f29f4944e30697098a28.tar.gz",
    "source_sha256": "042780994eb8363cd673e598a5355e3bffc33cb51052722ca885657e63eaeb0e",
    "license": "GPL-3"
  },
  "files": [
    {
      "package_object": "xCell.data",
      "sha256": "987f47ebfaf2c965879e12d4592cd0c0171444b98604c5b90a859049f275c8ea"
    }
  ],
  "signature_gene_count": 10808,
  "cell_types": [
    {"id":"aDC","label":"Activated dendritic cells"},
    {"id":"Adipocytes","label":"Adipocytes"},
    {"id":"Astrocytes","label":"Astrocytes"},
    {"id":"B-cells","label":"B cells"},
    {"id":"Basophils","label":"Basophils"},
    {"id":"CD4+ memory T-cells","label":"CD4+ memory T cells"},
    {"id":"CD4+ naive T-cells","label":"CD4+ naive T cells"},
    {"id":"CD4+ T-cells","label":"CD4+ T cells"},
    {"id":"CD4+ Tcm","label":"CD4+ central memory T cells"},
    {"id":"CD4+ Tem","label":"CD4+ effector memory T cells"},
    {"id":"CD8+ naive T-cells","label":"CD8+ naive T cells"},
    {"id":"CD8+ T-cells","label":"CD8+ T cells"},
    {"id":"CD8+ Tcm","label":"CD8+ central memory T cells"},
    {"id":"CD8+ Tem","label":"CD8+ effector memory T cells"},
    {"id":"cDC","label":"Conventional dendritic cells"},
    {"id":"Chondrocytes","label":"Chondrocytes"},
    {"id":"Class-switched memory B-cells","label":"Class-switched memory B cells"},
    {"id":"CLP","label":"Common lymphoid progenitors"},
    {"id":"CMP","label":"Common myeloid progenitors"},
    {"id":"DC","label":"Dendritic cells"},
    {"id":"Endothelial cells","label":"Endothelial cells"},
    {"id":"Eosinophils","label":"Eosinophils"},
    {"id":"Epithelial cells","label":"Epithelial cells"},
    {"id":"Erythrocytes","label":"Erythrocytes"},
    {"id":"Fibroblasts","label":"Fibroblasts"},
    {"id":"GMP","label":"Granulocyte-monocyte progenitors"},
    {"id":"Hepatocytes","label":"Hepatocytes"},
    {"id":"HSC","label":"Hematopoietic stem cells"},
    {"id":"iDC","label":"Immature dendritic cells"},
    {"id":"Keratinocytes","label":"Keratinocytes"},
    {"id":"ly Endothelial cells","label":"Lymphatic endothelial cells"},
    {"id":"Macrophages","label":"Macrophages"},
    {"id":"Macrophages M1","label":"M1 macrophages"},
    {"id":"Macrophages M2","label":"M2 macrophages"},
    {"id":"Mast cells","label":"Mast cells"},
    {"id":"Megakaryocytes","label":"Megakaryocytes"},
    {"id":"Melanocytes","label":"Melanocytes"},
    {"id":"Memory B-cells","label":"Memory B cells"},
    {"id":"MEP","label":"Megakaryocyte-erythroid progenitors"},
    {"id":"Mesangial cells","label":"Mesangial cells"},
    {"id":"Monocytes","label":"Monocytes"},
    {"id":"MPP","label":"Multipotent progenitors"},
    {"id":"MSC","label":"Mesenchymal stem cells"},
    {"id":"mv Endothelial cells","label":"Microvascular endothelial cells"},
    {"id":"Myocytes","label":"Myocytes"},
    {"id":"naive B-cells","label":"Naive B cells"},
    {"id":"Neurons","label":"Neurons"},
    {"id":"Neutrophils","label":"Neutrophils"},
    {"id":"NK cells","label":"NK cells"},
    {"id":"NKT","label":"Natural killer T cells"},
    {"id":"Osteoblast","label":"Osteoblasts"},
    {"id":"pDC","label":"Plasmacytoid dendritic cells"},
    {"id":"Pericytes","label":"Pericytes"},
    {"id":"Plasma cells","label":"Plasma cells"},
    {"id":"Platelets","label":"Platelets"},
    {"id":"Preadipocytes","label":"Preadipocytes"},
    {"id":"pro B-cells","label":"Pro-B cells"},
    {"id":"Sebocytes","label":"Sebocytes"},
    {"id":"Skeletal muscle","label":"Skeletal muscle"},
    {"id":"Smooth muscle","label":"Smooth muscle"},
    {"id":"Tgd cells","label":"Gamma delta T cells"},
    {"id":"Th1 cells","label":"T helper 1 cells"},
    {"id":"Th2 cells","label":"T helper 2 cells"},
    {"id":"Tregs","label":"Regulatory T cells"}
  ]
}
